{
  "requestId": "request-1",
  "runId": "run-1",
  "status": "completed",
  "messages": [
    {
      "messageId": "message-2",
      "role": "assistant",
      "content": "The API surface exposes three primary operations."
    }
  ],
  "usage": {
    "inputTokens": 32,
    "outputTokens": 14,
    "totalTokens": 46
  },
  "metadata": {
    "model": "neutral-test"
  }
}